Course Title,Bestseller
"100 Days of Code: The Complete Python Pro BootcampMaster Python by building 100 projects in 100 days. Learn data science, automation, build websites, games and apps!Rating: 4.7 out of 5366923 reviews56.5 total hours592 lecturesAll Levels",Yes
"The Complete Full-Stack Web Development BootcampBecome a Full-Stack Web Developer with just ONE course. HTML, CSS, Javascript, Node, React, PostgreSQL, Web3 and DAppsRating: 4.7 out of 5435513 reviews61.5 total hours374 lecturesAll Levels",Yes
"Machine Learning A-Z: AI, Python & R + ChatGPT Prize [2025]Learn to create Machine Learning Algorithms in Python and R from two Data Science experts. Code templates included.Rating: 4.5 out of 5196285 reviews43 total hours386 lecturesAll Levels",Yes
"The Complete JavaScript Course 2025: From Zero to Expert!The modern JavaScript course for everyone! Master JavaScript with projects, challenges and theory. Many courses in one!Rating: 4.7 out of 5222661 reviews71 total hours332 lecturesAll Levels",Yes
"Java Masterclass 2025: 130+ Hours of Expert LessonsGain real-world experience with OOP, coding exercises, and problem-solving for job-ready Java development skillsRating: 4.6 out of 5206359 reviews135.5 total hours736 lecturesAll Levels",Yes
"React - The Complete Guide 2025 (incl. Next.js, Redux)Dive in and learn React.js from scratch! Learn React, Hooks, Redux, React Router, Next.js, Best Practices and way more!Rating: 4.6 out of 5228831 reviews71.5 total hours726 lecturesAll Levels",Yes
"Angular - The Complete Guide (2025 Edition)Master Angular (formerly ""Angular 2"") and build awesome, reactive web apps with the successor of Angular.jsRating: 4.7 out of 5214570 reviews56 total hours757 lecturesAll Levels",Yes
"The Data Science Course: Complete Data Science Bootcamp 2025Complete Data Science Training: Math, Statistics, Python, Advanced Statistics in Python, Machine and Deep LearningRating: 4.6 out of 5152572 reviews32 total hours523 lecturesAll Levels",Yes
